{
  "$schema": "https://json-schema.org/draft/2020-12/schema",
  "$id": "urn:pto-isa:agentic-circuit:schema:opcode-catalog:0.4",
  "title": "Agentic Circuit Official Opcode Catalog 0.4",
  "type": "object",
  "additionalProperties": false,
  "required": ["schema", "version", "contract_epoch", "entries"],
  "properties": {
    "schema": {"const": "agentic-circuit-opcode-catalog"},
    "version": {"const": "0.4"},
    "contract_epoch": {"const": "0.4"},
    "entries": {
      "type": "array",
      "minItems": 1,
      "items": {"$ref": "#/$defs/entry"}
    }
  },
  "$defs": {
    "arity": {
      "type": "object",
      "additionalProperties": false,
      "required": ["min", "max"],
      "properties": {
        "min": {"type": "integer", "minimum": 0},
        "max": {
          "oneOf": [
            {"type": "integer", "minimum": 0},
            {"type": "null"}
          ]
        }
      }
    },
    "backend": {
      "type": "object",
      "additionalProperties": false,
      "required": ["available", "realization"],
      "properties": {
        "available": {"type": "boolean"},
        "realization": {"type": "string", "minLength": 1}
      }
    },
    "nameList": {
      "type": "array",
      "items": {
        "type": "string",
        "pattern": "^[A-Za-z_][A-Za-z0-9_]*$"
      },
      "uniqueItems": true
    },
    "entry": {
      "type": "object",
      "additionalProperties": false,
      "required": [
        "category",
        "constants",
        "effect",
        "gfsim",
        "inputs",
        "kind",
        "operation",
        "outputs",
        "payload_relation",
        "pyc",
        "refinement_observations",
        "role"
      ],
      "properties": {
        "category": {
          "enum": ["boundary", "combinational", "scheduling", "state", "structural", "transport"]
        },
        "constants": {"$ref": "#/$defs/nameList"},
        "effect": {
          "enum": ["atomic", "observation", "stateful", "structural", "verification"]
        },
        "gfsim": {"$ref": "#/$defs/backend"},
        "inputs": {"$ref": "#/$defs/arity"},
        "kind": {
          "type": "string",
          "pattern": "^[a-z][a-z0-9_]*$"
        },
        "operation": {
          "type": "string",
          "pattern": "^ac\\.[a-z][a-z0-9_]*(?:\\.[a-z][a-z0-9_]*)*$"
        },
        "outputs": {"$ref": "#/$defs/arity"},
        "payload_relation": {
          "enum": [
            "adapter_defined_request_and_response_payloads",
            "all_payloads_equal",
            "consume_input_payload",
            "declared_service_owner_array",
            "declared_storage_owner",
            "declared_output_payload",
            "input_output_payload_equal",
            "observe_input_payload",
            "positionally_equal_boundary_payloads",
            "positionally_equal_input_output_payloads",
            "region_yields_match_output_payloads",
            "selected_data_payload_matches_output"
          ]
        },
        "pyc": {"$ref": "#/$defs/backend"},
        "refinement_observations": {"$ref": "#/$defs/nameList"},
        "role": {"enum": ["design", "observation", "verification"]}
      }
    }
  }
}
