{"contract_epoch":"0.4","entries":[{"category":"state","constants":["definition","shape","stable_id","path","owner"],"effect":"stateful","gfsim":{"available":true,"realization":"gfsim::QueueMemoryBankArray storage owner"},"inputs":{"max":0,"min":0},"kind":"array_instance","operation":"ac.array","outputs":{"max":0,"min":0},"payload_relation":"declared_service_owner_array","pyc":{"available":true,"realization":"one_pyc.sync_mem_per_static_element"},"refinement_observations":["selected_bank","bank_busy","memory_write"],"role":"design"},{"category":"state","constants":["array","service","ordinal","depth","policy"],"effect":"stateful","gfsim":{"available":true,"realization":"dynamic_bank_select_and_completion_demux"},"inputs":{"max":1,"min":1},"kind":"array_invoke","operation":"ac.array.invoke","outputs":{"max":1,"min":1},"payload_relation":"adapter_defined_request_and_response_payloads","pyc":{"available":true,"realization":"fixed_selector_and_response_mux"},"refinement_observations":["request_transaction","response_transaction","selected_bank"],"role":"design"},{"category":"scheduling","constants":["output_depths","output_latencies"],"effect":"atomic","gfsim":{"available":true,"realization":"gfsim::QueueBarrier<std::tuple<Ts...>>"},"inputs":{"max":null,"min":2},"kind":"barrier","operation":"ac.barrier","outputs":{"max":null,"min":2},"payload_relation":"positionally_equal_input_output_payloads","pyc":{"available":true,"realization":"all_input_valid_and_all_output_ready_atomic_handshake"},"refinement_observations":["input_transactions","output_transactions","barrier_firing"],"role":"design"},{"category":"transport","constants":["output_depths","output_latencies"],"effect":"atomic","gfsim":{"available":true,"realization":"gfsim::QueueBroadcast<T,N>"},"inputs":{"max":1,"min":1},"kind":"broadcast","operation":"ac.broadcast","outputs":{"max":null,"min":2},"payload_relation":"all_payloads_equal","pyc":{"available":true,"realization":"all_output_ready_conjunction"},"refinement_observations":["input_transaction","output_transactions"],"role":"design"},{"category":"scheduling","constants":["credits","depth","latency"],"effect":"stateful","gfsim":{"available":true,"realization":"gfsim::QueueCredit<T,Cost>"},"inputs":{"max":1,"min":1},"kind":"credit","operation":"ac.credit","outputs":{"max":1,"min":1},"payload_relation":"input_output_payload_equal","pyc":{"available":true,"realization":"fixed_credit_register_window_and_countdown"},"refinement_observations":["accepted_transaction","completed_transaction","active_credits"],"role":"design"},{"category":"scheduling","constants":["capacity","resources","no_dependency","depth","latency"],"effect":"stateful","gfsim":{"available":true,"realization":"gfsim::QueueDependency<T,Key,Dependency,Resource,Cost>"},"inputs":{"max":1,"min":1},"kind":"dependency","operation":"ac.dependency","outputs":{"max":1,"min":1},"payload_relation":"input_output_payload_equal","pyc":{"available":true,"realization":"packed_dependency_window_resource_reservation_and_countdown"},"refinement_observations":["accepted_transaction","issued_transaction","completed_transaction"],"role":"design"},{"category":"boundary","constants":["message"],"effect":"verification","gfsim":{"available":true,"realization":"gfsim::QueueExpect<T,Predicate>"},"inputs":{"max":1,"min":1},"kind":"expect","operation":"ac.expect","outputs":{"max":0,"min":0},"payload_relation":"observe_input_payload","pyc":{"available":false,"realization":"pyc_testbench_boundary_only"},"refinement_observations":["predicate_input","assertion_outcome"],"role":"verification"},{"category":"state","constants":["depth","latency","max_iterations"],"effect":"stateful","gfsim":{"available":true,"realization":"gfsim::QueueFeedback<T,Update,Condition>"},"inputs":{"max":1,"min":1},"kind":"feedback","operation":"ac.feedback","outputs":{"max":1,"min":1},"payload_relation":"input_output_payload_equal","pyc":{"available":true,"realization":"valid_data_iteration_registers"},"refinement_observations":["input_transaction","output_transaction","iteration_limit"],"role":"design"},{"category":"transport","constants":["output_depths","output_latencies"],"effect":"stateful","gfsim":{"available":true,"realization":"gfsim::QueueFork<T,N>"},"inputs":{"max":1,"min":1},"kind":"fork","operation":"ac.fork","outputs":{"max":null,"min":2},"payload_relation":"all_payloads_equal","pyc":{"available":true,"realization":"per_output_delivered_registers"},"refinement_observations":["input_transaction","output_transactions"],"role":"design"},{"category":"state","constants":["data_type","entries","init","latency","stable_id","owner"],"effect":"stateful","gfsim":{"available":true,"realization":"gfsim::QueueMemoryArbiter storage owner"},"inputs":{"max":0,"min":0},"kind":"memory_instance","operation":"ac.memory.instance","outputs":{"max":0,"min":0},"payload_relation":"declared_storage_owner","pyc":{"available":true,"realization":"one_pyc.sync_mem_per_instance"},"refinement_observations":["memory_write","busy","selected_endpoint"],"role":"design"},{"category":"state","constants":["instance","ordinal","result_field","depth"],"effect":"stateful","gfsim":{"available":true,"realization":"gfsim::QueueMemoryArbiter<T,Data,N,...>"},"inputs":{"max":1,"min":1},"kind":"memory_request","operation":"ac.memory.request","outputs":{"max":1,"min":1},"payload_relation":"input_output_payload_equal","pyc":{"available":true,"realization":"pyc.sync_mem_with_aligned_request_state"},"refinement_observations":["request_transaction","response_transaction","memory_write"],"role":"design"},{"category":"transport","constants":["policy","depth","latency"],"effect":"stateful","gfsim":{"available":true,"realization":"gfsim::QueueMerge<T,N>"},"inputs":{"max":null,"min":2},"kind":"merge","operation":"ac.merge","outputs":{"max":1,"min":1},"payload_relation":"all_payloads_equal","pyc":{"available":true,"realization":"priority_or_round_robin_arbiter"},"refinement_observations":["selected_input_transaction","output_transaction"],"role":"design"},{"category":"boundary","constants":["name"],"effect":"observation","gfsim":{"available":true,"realization":"gfsim::QueueObserve<T>"},"inputs":{"max":1,"min":1},"kind":"observe","operation":"ac.observe","outputs":{"max":0,"min":0},"payload_relation":"observe_input_payload","pyc":{"available":true,"realization":"non_backpressuring_alias_probe"},"refinement_observations":["probe_value"],"role":"observation"},{"category":"scheduling","constants":["capacity","start","depth","latency"],"effect":"stateful","gfsim":{"available":true,"realization":"gfsim::QueueReorder<T,Key>"},"inputs":{"max":1,"min":1},"kind":"reorder","operation":"ac.reorder","outputs":{"max":1,"min":1},"payload_relation":"input_output_payload_equal","pyc":{"available":true,"realization":"tagged_register_bank_and_expected_key"},"refinement_observations":["accepted_transaction","retired_transaction","sequence_order"],"role":"design"},{"category":"transport","constants":["output_depths","output_latencies"],"effect":"atomic","gfsim":{"available":true,"realization":"gfsim::QueueRoute<T,N,Selector>"},"inputs":{"max":1,"min":1},"kind":"route","operation":"ac.route","outputs":{"max":null,"min":2},"payload_relation":"all_payloads_equal","pyc":{"available":true,"realization":"selector_decoder_and_ready_mux"},"refinement_observations":["input_transaction","selected_output_transaction"],"role":"design"},{"category":"structural","constants":["sym_name"],"effect":"structural","gfsim":{"available":true,"realization":"gfsim::Module_hierarchy"},"inputs":{"max":null,"min":0},"kind":"scope","operation":"ac.scope","outputs":{"max":null,"min":0},"payload_relation":"positionally_equal_boundary_payloads","pyc":{"available":true,"realization":"elaboration_time_scope_flattening"},"refinement_observations":["boundary_transactions"],"role":"design"},{"category":"transport","constants":["depth","latency"],"effect":"atomic","gfsim":{"available":true,"realization":"gfsim::QueueSelect<Control,T,N,Selector>"},"inputs":{"max":null,"min":3},"kind":"select","operation":"ac.select","outputs":{"max":1,"min":1},"payload_relation":"selected_data_payload_matches_output","pyc":{"available":true,"realization":"selector_mux_and_selected_ready_handshake"},"refinement_observations":["control_transaction","selected_input_transaction","output_transaction"],"role":"design"},{"category":"boundary","constants":[],"effect":"stateful","gfsim":{"available":true,"realization":"gfsim::QueueSink<T>"},"inputs":{"max":1,"min":1},"kind":"sink","operation":"ac.sink","outputs":{"max":0,"min":0},"payload_relation":"consume_input_payload","pyc":{"available":true,"realization":"ready_valid_output_boundary"},"refinement_observations":["output_transaction"],"role":"design"},{"category":"boundary","constants":["depth","latency"],"effect":"stateful","gfsim":{"available":true,"realization":"typed_source_boundary"},"inputs":{"max":0,"min":0},"kind":"source","operation":"ac.source","outputs":{"max":1,"min":1},"payload_relation":"declared_output_payload","pyc":{"available":true,"realization":"ready_valid_input_boundary"},"refinement_observations":["input_transaction"],"role":"design"},{"category":"combinational","constants":["output_depths","output_latencies"],"effect":"atomic","gfsim":{"available":true,"realization":"gfsim::QueueTransform/QueueAtomicTransform"},"inputs":{"max":null,"min":1},"kind":"transform","operation":"ac.transform","outputs":{"max":null,"min":1},"payload_relation":"region_yields_match_output_payloads","pyc":{"available":true,"realization":"pure_logic_plus_ready_valid_fifos"},"refinement_observations":["accepted_transaction","output_transaction"],"role":"design"}],"schema":"agentic-circuit-opcode-catalog","version":"0.4"}
